project_id,experience_id,project_name,project_type,start_date,end_date,primary_skills,impact,description
PROJ001,EXP001,Snowflake Cloud Data Platform Migration,Platform Modernization,2022-01,2024-12,"['Snowflake', 'AWS', 'Cloud Architecture', 'VPC', 'Private Link', 'InfoSec', 'Data Governance']",Sunset legacy warehousing and deployed future-ready analytics platform enabling AI/LLM initiatives,Orchestrated end-to-end cloud data modernization from ideation through deployment including executive buy-in security architecture and cross-functional team delivery
PROJ002,EXP001,AI Enablement with Snowflake Cortex Analyst,AI Integration,2024-01,2024-12,"['Snowflake Cortex', 'NLP-to-SQL', 'AI/ML', 'Data Analytics']",Enabled rapid AI value extraction and advanced analytics pilots in DNS and network traffic analysis,Integrated NLP-to-SQL capabilities via Cortex Analyst for natural language querying and AI-powered insights
PROJ003,EXP001,Enterprise Data Governance Framework,Governance,2023-01,2024-12,"['Data Governance', 'Data Classification', 'Tagging Schema', 'Cost Management', 'Snowflake']",Classified thousands of tables established cost controls and connected platform utilization to budgeting,Launched comprehensive data governance including asset classification user tagging cost dashboards and budget alignment
PROJ004,EXP001,Snowflake Platform Evangelism & Adoption,Change Management,2023-06,2024-12,"['Change Management', 'Stakeholder Engagement', 'Platform Training', 'Self-Service Analytics']",Evangelized platform to 70+ stakeholders and enabled self-service access for data scientists,Showcased Snowflake capabilities drove adoption and established platform as strategic backbone for AI initiatives
PROJ005,EXP003,Tableau Enterprise Standardization,BI Platform,2016-01,2020-12,"['Tableau', 'Dashboard Design', 'User Training', 'BI Strategy']",Grew platform usage to 100+ analysts and business leaders positioning BI as core decision driver,Pioneered Tableau adoption and standardized reporting functionality across enterprise
PROJ006,EXP003,Channel Marketing Predictive Model,Revenue Optimization,2017-01,2019-12,"['Predictive Modeling', 'Forecasting', 'Statistical Analysis', 'Revenue Analytics']",Optimized marketing spend shaped promotional strategy and unlocked new revenue streams,Developed predictive model for channel marketing rebate program with detailed simulations navigating legal and regulatory constraints
PROJ007,EXP003,BI Infrastructure Security Migration,Infrastructure,2018-01,2020-12,"['Data Security', 'Infrastructure Migration', 'Data Warehouse', 'Governance']",Improved governance and tightened information security controls while maintaining business continuity,Migrated BI infrastructure for data warehouse team matching architectural standards and elevating security posture
PROJ008,EXP003,Executive Dashboard Redesign,Executive Reporting,2016-01,2018-12,"['Dashboard Design', 'KPI Development', 'Executive Reporting', 'Data Visualization']",Ensured strategic KPIs were tracked and provided executive visibility into business performance,Redesigned executive dashboards and reporting ecosystems for strategic decision-making
PROJ009,EXP003,Hadoop-R Statistical Modeling Integration,Data Science,2019-01,2021-12,"['R Programming', 'Hadoop', 'Statistical Modeling', 'Machine Learning', 'Big Data']",Advanced forecasting and machine learning capabilities enabling sophisticated analytics,Integrated R-based statistical modeling into Hadoop clusters expanding data science capabilities
